{
  "package": "CONTACT-CODEC-01/mailbox-grant-revocation-v1",
  "decision": "DR-0083",
  "status": "FROZEN_TARGET_NOT_ACTIVE",
  "runtimeActivation": false,
  "owner": "deep-protocol",
  "magic": "MGR1",
  "version": 1,
  "suite": "0x0201",
  "fieldCount": 12,
  "minimumBytes": 327,
  "maximumBytes": 65863,
  "maximumRevokedSerials": 4096,
  "maximumSnapshotLifetimeSeconds": 300,
  "fields": [
    { "tag": 1, "name": "networkId", "bytes": 16, "nonzero": true },
    { "tag": 2, "name": "pma2CoreReference", "bytes": 38, "magic": "PMA2", "version": 1 },
    { "tag": 3, "name": "domain", "bytes": 1, "values": [1, 2] },
    { "tag": 4, "name": "issuerPublicKey", "bytes": 32, "nonzero": true },
    { "tag": 5, "name": "generation", "bytes": 8, "minimum": 1 },
    { "tag": 6, "name": "predecessorCoreHash", "bytes": 32, "zeroIffGeneration": 1 },
    { "tag": 7, "name": "issuedAt", "bytes": 8 },
    { "tag": 8, "name": "notBefore", "bytes": 8 },
    { "tag": 9, "name": "expiresAt", "bytes": 8 },
    { "tag": 10, "name": "revokedSerialCount", "bytes": 4, "minimum": 0, "maximum": 4096 },
    { "tag": 11, "name": "sortedRevokedSerials", "elementBytes": 16, "countTag": 10, "strictlyIncreasing": true, "nonzeroElements": true },
    { "tag": 12, "name": "issuerSignature", "bytes": 64, "nonzero": true }
  ],
  "unsignedTags": [1, 2, 3, 4, 5, 6, 7, 8, 9, 10, 11],
  "signatureDomain": "Deep/XPoint/V1/MGR1/issuer",
  "coreDomain": "Deep/XPoint/V1/MGR1/core",
  "signerSource": "exact current root-authorized PMA2 role issuer",
  "timeSource": "complete current host protected monotonic lower/upper interval",
  "floorScope": ["networkId", "pma2CoreReference", "domain", "issuerPublicKey"],
  "floorSource": "exact previously accepted signed snapshot restored from protected host state",
  "initialEnrollment": {
    "scope": "explicit genuinely new protected host scope only",
    "snapshot": "fresh canonical current-role issuer-signed snapshot at any generation >=1",
    "initialPin": "immutable exact bytes; restored floor rejects lower generation or changed bytes at initial generation",
    "existingFloor": "exact replay or sequential verified successor only; no reset or gap bypass"
  },
  "serialRetention": "cumulative within exact PMA2 scope; no pruning or serial reuse",
  "historicalCatchUp": "existing protected floor only; exact signed replay or sequential successor; current host and no future not-before; expired candidate advances historical floor with exact readback but no admission capability",
  "issuerReservation": "durably reserve exact existing SIGINPUT before signing; retry identical bytes after uncertainty or expiry; verify actual role signature and committed readback; expired winner is history only and needs a fresh successor",
  "clientWireChanged": false,
  "networkDistributionWireChanged": false,
  "nodeControl": {
    "method": "GET",
    "path": "/api/v1/node-control/mailbox-revocations/{network}/{policy}/{role}/{generation}",
    "mediaType": "application/vnd.deep.mailbox-grant-revocation.v1+octet-stream",
    "network": "nonzero lowercase hex32",
    "policy": "nonzero PMA2 core hash lowercase hex64",
    "role": ["1", "2"],
    "generation": "latest or unpadded decimal1..1048576",
    "bodyBytes": 0,
    "response": "one exact retained signed MGR1; no authority from HTTP",
    "requestTimeoutSeconds": 5,
    "maximumRecordsPerRequest": 1,
    "singleFlight": true,
    "healthConsumesNonce": false
  },
  "retiredAuthorityReject": ["PMA1", "PMR1", "P04", "RIP1"],
  "activationGates": ["current closed producer APIs and signed vectors", "native protected floor install/readback/reopen", "current node admission and peer rechecks", "real issuer cumulative authoring/renewal", "connected text and physical E2E"]
}
